{
  "schema_version": "training_observation.v1",
  "ids": {
    "observation_id": "obs_example_0001",
    "user_ref": "user_example_0001",
    "subject_ref": "subject_math",
    "topic_ref": "topic_linear_equations",
    "session_ref": "session_example_0001",
    "content_event_ref": "content_event_example_0001",
    "test_event_ref": "test_event_example_0001"
  },
  "timestamps": {
    "decision_created_at": "2026-01-15T10:00:00Z",
    "outcome_observed_at": "2026-01-15T10:20:00Z"
  },
  "source": {
    "source_kind": "synthetic",
    "source_name": "eduai_contract_example",
    "source_version": "v1",
    "adapter_version": null
  },
  "pre_decision_features": {
    "prior_attempts_count": 12,
    "prior_correct_rate": 0.58,
    "recent_correct_rate": 0.5,
    "recent_attempts_count": 4,
    "topic_seen_count": 3,
    "minutes_since_last_activity": 45,
    "session_position": 2,
    "declared_preference_difficulty": "medium",
    "declared_preference_depth": "standard",
    "declared_preference_format": "step_by_step"
  },
  "candidate_config": {
    "difficulty": "medium",
    "depth": "standard",
    "support_level": "guided",
    "presentation_format": "step_by_step",
    "examples_level": "multiple",
    "terminology_level": "balanced"
  },
  "delivered_config": {
    "difficulty": "medium",
    "depth": "standard",
    "support_level": "guided",
    "presentation_format": "step_by_step",
    "examples_level": "multiple",
    "terminology_level": "balanced"
  },
  "outcome": {
    "pre_score": 0.4,
    "post_score": 0.7,
    "max_score": 1,
    "next_step_success": true,
    "normalized_learning_gain": 0.5,
    "outcome_available": true
  },
  "leakage_guard": {
    "features_cutoff_at": "2026-01-15T10:00:00Z",
    "uses_only_pre_decision_data": true,
    "notes": null
  },
  "policy_context": {
    "policy_id": null,
    "model_version": null,
    "backend_kind": null,
    "fallback_used": false
  }
}
